{
  "$schema": "https://json-schema.org/draft/2020-12/schema",
  "$id": "https://clawbio.org/schemas/project-schema/figure-1.4.0.json",
  "title": "ClawBio Scholar Figure",
  "type": "object",
  "additionalProperties": false,
  "required": [
    "id",
    "project_id",
    "title",
    "caption",
    "generated_at",
    "inputs",
    "output",
    "render",
    "environment"
  ],
  "properties": {
    "id": {
      "type": "string",
      "pattern": "^[a-z0-9]+(?:-[a-z0-9]+)*$"
    },
    "project_id": {
      "type": "string",
      "pattern": "^[a-z0-9]+(?:-[a-z0-9]+)*$"
    },
    "title": {
      "type": "string",
      "minLength": 1
    },
    "caption": {
      "type": "string",
      "minLength": 1
    },
    "generated_at": {
      "type": "string",
      "format": "date-time"
    },
    "upstream_analysis_run_ids": {
      "type": "array",
      "uniqueItems": true,
      "items": {
        "type": "string",
        "pattern": "^[a-z0-9]+(?:-[a-z0-9]+)*$"
      }
    },
    "inputs": {
      "type": "array",
      "items": {
        "$ref": "#/$defs/inputArtifact"
      }
    },
    "output": {
      "$ref": "#/$defs/artifact"
    },
    "render": {
      "$ref": "#/$defs/render"
    },
    "environment": {
      "$ref": "#/$defs/environment"
    },
    "panels": {
      "type": "array",
      "items": {
        "$ref": "#/$defs/panel"
      }
    },
    "notes": {
      "type": "string",
      "minLength": 1
    }
  },
  "$defs": {
    "artifact": {
      "type": "object",
      "additionalProperties": false,
      "required": [
        "id",
        "kind",
        "path"
      ],
      "properties": {
        "id": {
          "type": "string",
          "pattern": "^[a-z0-9]+(?:-[a-z0-9]+)*$"
        },
        "kind": {
          "type": "string",
          "minLength": 1
        },
        "path": {
          "type": "string",
          "minLength": 1
        },
        "sha256": {
          "type": "string",
          "pattern": "^[a-f0-9]{64}$"
        },
        "media_type": {
          "type": "string",
          "minLength": 1
        }
      }
    },
    "inputArtifact": {
      "type": "object",
      "additionalProperties": false,
      "required": [
        "id",
        "kind",
        "path"
      ],
      "properties": {
        "id": {
          "type": "string",
          "pattern": "^[a-z0-9]+(?:-[a-z0-9]+)*$"
        },
        "kind": {
          "type": "string",
          "minLength": 1
        },
        "path": {
          "type": "string",
          "minLength": 1
        },
        "sha256": {
          "type": "string",
          "pattern": "^[a-f0-9]{64}$"
        },
        "media_type": {
          "type": "string",
          "minLength": 1
        },
        "source_analysis_run_id": {
          "type": "string",
          "pattern": "^[a-z0-9]+(?:-[a-z0-9]+)*$"
        }
      }
    },
    "render": {
      "type": "object",
      "additionalProperties": false,
      "required": [
        "engine",
        "entrypoint"
      ],
      "properties": {
        "engine": {
          "type": "string",
          "minLength": 1
        },
        "entrypoint": {
          "type": "string",
          "minLength": 1
        },
        "command": {
          "type": "string",
          "minLength": 1
        },
        "version": {
          "type": "string",
          "minLength": 1
        },
        "parameters": {
          "type": "object"
        }
      }
    },
    "environment": {
      "type": "object",
      "additionalProperties": false,
      "required": [
        "runtime"
      ],
      "properties": {
        "runtime": {
          "type": "string",
          "minLength": 1
        },
        "os": {
          "type": "string",
          "minLength": 1
        },
        "container_image": {
          "type": "string",
          "minLength": 1
        },
        "packages": {
          "type": "array",
          "items": {
            "type": "string",
            "minLength": 1
          }
        }
      }
    },
    "panel": {
      "type": "object",
      "additionalProperties": false,
      "required": [
        "id",
        "label",
        "input_ids"
      ],
      "properties": {
        "id": {
          "type": "string",
          "pattern": "^[a-z0-9]+(?:-[a-z0-9]+)*$"
        },
        "label": {
          "type": "string",
          "minLength": 1
        },
        "description": {
          "type": "string",
          "minLength": 1
        },
        "input_ids": {
          "type": "array",
          "minItems": 1,
          "items": {
            "type": "string",
            "pattern": "^[a-z0-9]+(?:-[a-z0-9]+)*$"
          }
        }
      }
    }
  }
}
